{
  "breslow_qualifier": "exact",
  "breslow_thickness_mm": 0.6,
  "diagnosis": "invasive_melanoma",
  "document_id": "MEL-001-B",
  "laterality": "left",
  "margins": {
    "in_situ_deep": "not_involved",
    "in_situ_peripheral": "involved",
    "invasive_deep": "not_involved",
    "invasive_peripheral": "not_involved"
  },
  "mitotic_qualifier": "exact",
  "mitotic_rate_per_mm2": 0.0,
  "specimen_site": "upper back",
  "staging": {
    "pM": null,
    "pN": null,
    "pT": "pT1a",
    "stage_group": null
  },
  "ulceration": "not_identified"
}
